{
  "id": "img-safety-zones-001",
  "file": "lipoaspiracao/lipo-anat-zonas-seguranca.png",
  "subject": "zonas de segurança e perigo na lipoaspiração — estruturas neurovasculares vulneráveis",
  "role": "overview",
  "source": "Rohrich & Beran, Grabb & Smith's Plastic Surgery, 8ª Ed., 2020",
  "credit": "Adaptado de Rohrich & Beran, Grabb & Smith, 8ª Ed., 2020",
  "default_caption": "Mapa de zonas de perigo: submentoniano (n. marginal), virilha (vasos femorais), face medial da coxa (v. safena magna) e abdome profundo (perfuração visceral).",
  "labels": [
    { "num": 1, "text": "Triângulo submentoniano — nervo marginal da mandíbula; manter cânula > 2 cm abaixo da borda mandibular." },
    { "num": 2, "text": "Região inguinal — artéria e veia femorais; pulsação palpável guia a distância segura." },
    { "num": 3, "text": "Face medial da coxa — v. safena magna e ramos do nervo safeno." },
    { "num": 4, "text": "Região glútea profunda — nervo ciático; cânula não deve ultrapassar a fáscia muscular." },
    { "num": 5, "text": "Abdome profundo — peritônio; perfuração visceral em pacientes com diástase ou hérnia." }
  ],
  "applicable_topics": ["lipoaspiracao"],
  "status": "available"
}
