{
  "id": "img-bony-pyramid-001",
  "file": "rinoplastia/fig19-27-osteotomias-laterais.jpeg",
  "subject": "pirâmide óssea nasal — osteotomias laterais percutâneas descontínuas em três variantes",
  "role": "surgical",
  "source": "Neligan 2023, vol. 2, cap. 19 — Closed Rhinoplasty",
  "credit": "Adaptado de Neligan 2023, vol. 2, cap. 19",
  "default_caption": "Osteotomias laterais percutâneas descontínuas sobre a pirâmide óssea: (A) low-to-high, (B) low-to-low e (C) duplo nível — destacam ossos nasais e processos frontais da maxila.",
  "labels": [
    {"num": 1, "text": "Ossos nasais — estrutura rígida do terço superior; mais espessos na raiz, mais finos lateralmente."},
    {"num": 2, "text": "Processo frontal da maxila — flanco lateral da pirâmide óssea; zona de espessura diminuída que permite fraturas previsíveis."},
    {"num": 3, "text": "Trajetória low-to-high (A) — osteotomia ascendente que preserva triângulo ósseo lateral."},
    {"num": 4, "text": "Trajetória low-to-low (B) — osteotomia que mobiliza toda a parede lateral."},
    {"num": 5, "text": "Trajetória duplo nível (C) — combinação para controle máximo da largura óssea."},
    {"num": 6, "text": "Osteótomo percutâneo — instrumentação de 2 mm inserida por punctura; minimiza edema e equimose."}
  ],
  "applicable_topics": ["rinoplastia"],
  "status": "available"
}
