{
  "id": "img-nariz-subunidades-burget-menick",
  "file": "reconstrucao-de-nariz/nariz-subunidades-burget-menick.png",
  "subject": "Sub-unidades estéticas do nariz (Burget-Menick): dorso, paredes laterais, ponta, asas, columela, triângulos moles",
  "role": "overview",
  "source": "Neligan 2023, vol. 3, cap. 3 — Aesthetic nasal reconstruction",
  "credit": "Adaptado de Neligan 2023",
  "default_caption": "Anatomia de superfície, contorno e sub-unidades estéticas do nariz segundo Burget e Menick (Neligan 2023, vol. 3, cap. 3).",
  "labels": [],
  "applicable_topics": ["reconstrucao-de-nariz"],
  "status": "available"
}
