{
  "id": "img-auricular-landmarks-001",
  "file": "otoplastia/oto-anat-pavilhao-anatomia.jpg",
  "subject": "marcos de superfície do pavilhão auricular — hélice, anti-hélice, tragus, antitragus, concha e lóbulo",
  "role": "overview",
  "source": "Neligan 2023, vol. 3, cap. 28 — Otoplasty",
  "credit": "Adaptado de Neligan 2023, vol. 3, cap. 28",
  "default_caption": "Dimensões adultas: altura ~6 cm, largura ~3,5 cm; ângulo cefaloauricular normal 25-35 graus.",
  "labels": [
    { "num": 1, "text": "Hélice — borda superior enrolada do pavilhão." },
    { "num": 2, "text": "Anti-hélice — crista paralela interna; hipoplasia gera orelha em abano." },
    { "num": 3, "text": "Tragus — protuberância anterior ao meato acústico externo." },
    { "num": 4, "text": "Concha — depressão central (cymba + cavum); profundidade ideal ~15 mm." },
    { "num": 5, "text": "Lóbulo — porção inferior sem cartilagem; avaliar protrusão isolada." },
    { "num": 6, "text": "Crus helicis — divide concha em cymba (superior) e cavum (inferior)." }
  ],
  "applicable_topics": ["otoplastia"],
  "status": "available"
}
