{
  "id": "img-lower-orbital-fat-001",
  "file": "blefaroplastia/blef-13-31-gordura-compartimentos-inferiores.png",
  "subject": "compartimentos de gordura inferior (medial, central, lateral) separados pelo oblíquo inferior",
  "role": "detail",
  "source": "Neligan 2023, vol. 2, cap. 13 — Blepharoplasty",
  "credit": "Adaptado de Neligan 2023, vol. 2, cap. 13",
  "default_caption": "Três compartimentos gordurosos inferiores delimitados pelo músculo oblíquo inferior: medial (mais volumoso, herniado), central e lateral. Técnica transconjuntival de acesso.",
  "labels": [
    { "num": 1, "text": "Inferior oblique muscle — delimitador principal entre compartimentos." },
    { "num": 2, "text": "Medial compartment — gordura pálida e firme; maior contribuidor da herniação." },
    { "num": 3, "text": "Central compartment — gordura lobulada entre oblíquo e lateral." },
    { "num": 4, "text": "Lateral compartment — pode conter glândula lacrimal; cuidado ao ressecar." },
    { "num": 5, "text": "Capsulopalpebral fascia — estrutura posterior delimitadora inferior." }
  ],
  "applicable_topics": ["blefaroplastia"],
  "status": "available"
}
