{
  "id": "img-huger-zones-001",
  "file": "abdominoplastia/abdo-anat-huger-ilustracao.jpg",
  "subject": "zonas de perfusao de Huger (I/II/III) da parede abdominal anterior",
  "role": "overview",
  "source": "Neligan 2023, vol. 2, cap. 27 - Matarasso (Abdominoplasty), baseado em Huger 1979",
  "credit": "Adaptado de Neligan 2023, vol. 2, cap. 27 - Matarasso",
  "default_caption": "Tres zonas de perfusao da parede abdominal anterior (Huger, 1979); apos abdominoplastia, a Zona III sustenta o retalho.",
  "labels": [
    { "num": 1, "text": "Zona I (central) - DIEA (epigastrica inferior profunda) + SIEA (superficial); perfusao dominante no abdome nao operado, ligada na disseccao." },
    { "num": 2, "text": "Zona II (inguinal) - SCIA (circunflexa iliaca superficial) + SIEA; territorio inferior, tambem comprometido." },
    { "num": 3, "text": "Zona III (lateral) - intercostais, subcostais e lombares (perfurantes segmentares); passa a dominante apos abdominoplastia." }
  ],
  "applicable_topics": ["abdominoplastia", "dermolipectomia"],
  "status": "available"
}
