{
  "id": "img-gluteal-neurovascular-001",
  "file": "gluteoplastia/glut-anat-neurovascular.png",
  "subject": "feixe neurovascular da região glútea — artérias, nervos e forames supra/infrapiriforme",
  "role": "overview",
  "source": "Neligan 2023, vol. 2, cap. 28; Multi-Society Task Force BBL 2018/2022",
  "credit": "Adaptado de Neligan 2023, vol. 2, cap. 28",
  "default_caption": "Emergência das estruturas neurovasculares pelos forames supra e infrapiriforme; zona de perigo intramuscular no BBL.",
  "labels": [
    { "num": 1, "text": "Forame suprapiriforme — passagem da artéria glútea superior e do nervo glúteo superior." },
    { "num": 2, "text": "Forame infrapiriforme — passagem da artéria glútea inferior, nervo glúteo inferior e nervo ciático." },
    { "num": 3, "text": "Artéria glútea superior — irriga porção superior; lesão cria sangramento em dissecção submuscular." },
    { "num": 4, "text": "Artéria glútea inferior — veia homônima é o principal sítio de embolia gordurosa no BBL intramuscular." },
    { "num": 5, "text": "Nervo ciático — desce entre trocânter maior e tuberosidade isquiática; risco de neuropraxia em implante submuscular." }
  ],
  "applicable_topics": ["gluteoplastia"],
  "status": "available"
}
